cluster,name,description,entity,risk_tier,human_approval,dependencies,purpose
07-ddmf-development-finance,catalytic-capital-optimizer,"Determines the minimum, best-structured Danantara capital needed to unlock maximum external capital, capability, and development outcome. Use for anchor investments, first-loss layers, guarantees, and project-development facilities.",DDMF,critical,DDMF investment authority,,"Determines the minimum, best-structured Danantara capital needed to unlock maximum external capital, capability, and development outcome. Use for anchor investments, first-loss layers, guarantees, and project-development facilities."
07-ddmf-development-finance,multilateral-partner-matcher,"Matches projects with suitable multilateral, bilateral, development-finance, export-credit, philanthropic, and institutional partners based on instruments, mandate, geography, sector, standards, and knowledge contribution.",DDMF,high,Partnership authority,,"Matches projects with suitable multilateral, bilateral, development-finance, export-credit, philanthropic, and institutional partners based on instruments, mandate, geography, sector, standards, and knowledge contribution."
07-ddmf-development-finance,public-service-obligation-analyzer,"Separates commercial activities from public-service obligations, quantifies costs and outcomes, defines compensation mechanisms, and prevents cross-subsidy opacity. Use for infrastructure and essential-service projects.",DDMF/BPI,critical,Mandated public authority,,"Separates commercial activities from public-service obligations, quantifies costs and outcomes, defines compensation mechanisms, and prevents cross-subsidy opacity. Use for infrastructure and essential-service projects."
07-ddmf-development-finance,socioeconomic-multiplier-modeler,"Models direct, indirect, induced, regional, employment, productivity, tax, import, domestic-value, and distributional effects with transparent assumptions. Use to compare development pathways and validate claimed national impact.",DDMF/BPI,high,Impact and economic authority,,"Models direct, indirect, induced, regional, employment, productivity, tax, import, domestic-value, and distributional effects with transparent assumptions. Use to compare development pathways and validate claimed national impact."
07-ddmf-development-finance,project-delivery-monitor,"Monitors scope, schedule, cost, quality, permits, land, procurement, financing, contractors, safeguards, benefits, and critical-path risks. Use from development through commissioning and stabilization.",DDMF,high,Project sponsor,,"Monitors scope, schedule, cost, quality, permits, land, procurement, financing, contractors, safeguards, benefits, and critical-path risks. Use from development through commissioning and stabilization."
07-ddmf-development-finance,development-outcome-monitor,"Tracks whether funded projects deliver agreed return, service, resilience, employment, capability, inclusion, environmental, and capital-mobilization outcomes. Use after financial close and throughout operations.",DDMF,high,DDMF impact owner,,"Tracks whether funded projects deliver agreed return, service, resilience, employment, capability, inclusion, environmental, and capital-mobilization outcomes. Use after financial close and throughout operations."
08-cross-functional,enterprise-risk-aggregator,"Aggregates financial, investment, operational, strategic, legal, technology, ESG, reputation, concentration, and systemic risks across entities while preventing double counting. Use for enterprise risk reviews and escalation.",BPI/DAM/DIM/DDMF,critical,Enterprise risk authority,,"Aggregates financial, investment, operational, strategic, legal, technology, ESG, reputation, concentration, and systemic risks across entities while preventing double counting. Use for enterprise risk reviews and escalation."
08-cross-functional,scenario-stress-testing,"Designs coherent base, upside, downside, severe, and reverse-stress scenarios; quantifies impacts, breakpoints, management actions, and residual risk. Use for investments, portfolios, transformations, liquidity, and resilience decisions.",BPI/DAM/DIM/DDMF,high,Risk and decision owner,,"Designs coherent base, upside, downside, severe, and reverse-stress scenarios; quantifies impacts, breakpoints, management actions, and residual risk. Use for investments, portfolios, transformations, liquidity, and resilience decisions."
08-cross-functional,financial-model-validator,"Independently checks formulas, logic, inputs, circularity, units, scenarios, accounting consistency, outputs, controls, and documentation of financial models. Use before material reliance or approval.",DAM/DIM/DDMF,critical,Independent model validation,,"Independently checks formulas, logic, inputs, circularity, units, scenarios, accounting consistency, outputs, controls, and documentation of financial models. Use before material reliance or approval."
08-cross-functional,legal-sufficiency-checker,"Tests whether a proposal has adequate legal basis, authority, approvals, enforceability, documentation, rights, remedies, and compliance while distinguishing legal permissibility from strategic wisdom. Use before binding action.",BPI/DAM/DIM/DDMF,critical,Legal authority,,"Tests whether a proposal has adequate legal basis, authority, approvals, enforceability, documentation, rights, remedies, and compliance while distinguishing legal permissibility from strategic wisdom. Use before binding action."
08-cross-functional,governance-board-paper-reviewer,"Reviews board and committee papers for decision clarity, authority, evidence, alternatives, risks, conflicts, dissent, financial impact, conditions, and auditability. Use before circulation or meeting submission.",BPI/DAM/DIM/DDMF,high,Company secretary/governance owner,,"Reviews board and committee papers for decision clarity, authority, evidence, alternatives, risks, conflicts, dissent, financial impact, conditions, and auditability. Use before circulation or meeting submission."
08-cross-functional,procurement-commercial-strategy,"Designs sourcing, packaging, competition, evaluation, contracting, incentives, risk allocation, local capability, lifecycle cost, and supplier governance. Use for strategic procurement and major project contracting.",BPI/DAM/DIM/DDMF,high,Procurement authority,,"Designs sourcing, packaging, competition, evaluation, contracting, incentives, risk allocation, local capability, lifecycle cost, and supplier governance. Use for strategic procurement and major project contracting."
08-cross-functional,cybersecurity-by-design,"Defines security architecture, threat model, identity, access, encryption, monitoring, resilience, supply-chain security, incident response, and assurance from project inception. Use for digital platforms, AI, data, and critical infrastructure.",BPI/DAM/DIM/DDMF,critical,CISO/security authority,,"Defines security architecture, threat model, identity, access, encryption, monitoring, resilience, supply-chain security, incident response, and assurance from project inception. Use for digital platforms, AI, data, and critical infrastructure."
08-cross-functional,data-sovereignty-assessor,"Determines which data, models, cloud layers, cryptographic control, operational access, and intellectual property require national or enterprise control. Use for digital infrastructure, AI, cloud, data-sharing, and foreign partnerships.",BPI/DAM/DIM/DDMF,critical,"Data, security, and strategic authority",,"Determines which data, models, cloud layers, cryptographic control, operational access, and intellectual property require national or enterprise control. Use for digital infrastructure, AI, cloud, data-sharing, and foreign partnerships."
08-cross-functional,technology-transfer-assessor,"Tests whether partnerships deliver enduring local know-how, IP access, engineering capability, supplier development, training, standards, and operating independence. Use for foreign investment, procurement, licensing, and joint ventures.",BPI/DAM/DIM/DDMF,high,Technology/industrial authority,,"Tests whether partnerships deliver enduring local know-how, IP access, engineering capability, supplier development, training, standards, and operating independence. Use for foreign investment, procurement, licensing, and joint ventures."
08-cross-functional,industrialization-hilirisasi-analyzer,"Assesses value-chain upgrading, domestic value added, technology depth, productivity, export competitiveness, resource security, ecosystem readiness, and environmental constraints. Use for industrialization and downstream-investment decisions.",BPI/DIM/DDMF,high,Industrial strategy authority,,"Assesses value-chain upgrading, domestic value added, technology depth, productivity, export competitiveness, resource security, ecosystem readiness, and environmental constraints. Use for industrialization and downstream-investment decisions."
08-cross-functional,selective-import-substitution-test,"Tests whether proposed import substitution is strategically critical, economically competitive, technologically feasible, time-bound, and superior to diversification or trade alternatives. Use before granting support or protection.",BPI/DIM/DDMF,critical,Strategic and investment authority,,"Tests whether proposed import substitution is strategically critical, economically competitive, technologically feasible, time-bound, and superior to diversification or trade alternatives. Use before granting support or protection."
08-cross-functional,national-champion-competitiveness,"Assesses whether scale, capabilities, economics, governance, innovation, and international market access can support global competitiveness without permanent protection. Use for consolidation, expansion, and national-champion strategies.",BPI/DAM/DIM,high,Strategy and portfolio authority,,"Assesses whether scale, capabilities, economics, governance, innovation, and international market access can support global competitiveness without permanent protection. Use for consolidation, expansion, and national-champion strategies."
08-cross-functional,job-quality-and-productivity-impact,"Measures direct and indirect jobs, wages, skills, formalization, safety, inclusion, productivity, durability, and displacement effects. Use when employment is a stated investment, transformation, or development outcome.",BPI/DAM/DIM/DDMF,high,Impact owner,,"Measures direct and indirect jobs, wages, skills, formalization, safety, inclusion, productivity, durability, and displacement effects."
08-cross-functional,stakeholder-communications-planner,"Maps stakeholders, interests, influence, concerns, disclosures, engagement sequence, messages, evidence, commitments, and escalation. Use for transactions, transformations, projects, incidents, partnerships, and public accountability.",BPI/DAM/DIM/DDMF,high,Communications and decision owner,,"Maps stakeholders, interests, influence, concerns, disclosures, engagement sequence, messages, evidence, commitments, and escalation. Use for transactions, transformations, projects, incidents, partnerships, and public accountability."
09-sector-overlays,energy-transition-sector-pack,"Provides sector-specific market, regulation, technology, grid, resource, contracting, financing, valuation, risk, ESG, and sovereignty analysis for renewable energy, storage, grids, and transition assets. Use with DAM, DIM, or DDMF workflows.",DAM/DIM/DDMF,high,Sector and decision owner,,"Provides sector-specific market, regulation, technology, grid, resource, contracting, financing, valuation, risk, ESG, and sovereignty analysis for renewable energy, storage, grids, and transition assets. Use with DAM, DIM, or DDMF workflows."
09-sector-overlays,upstream-energy-sector-pack,"Provides sector-specific subsurface, reserves, development, production, fiscal, commodity, decommissioning, emissions, partner, valuation, and geopolitical analysis for upstream energy. Use with DAM, DIM, or DDMF workflows.",DAM/DIM/DDMF,high,Sector and decision owner,,"Provides sector-specific subsurface, reserves, development, production, fiscal, commodity, decommissioning, emissions, partner, valuation, and geopolitical analysis for upstream energy. Use with DAM, DIM, or DDMF workflows."
09-sector-overlays,minerals-downstream-sector-pack,"Provides value-chain, resource, processing, technology, power, logistics, commodity, market, ESG, local-content, and competitiveness analysis for minerals and downstream industries. Use with DAM, DIM, or DDMF workflows.",DAM/DIM/DDMF,high,Sector and decision owner,,"Provides value-chain, resource, processing, technology, power, logistics, commodity, market, ESG, local-content, and competitiveness analysis for minerals and downstream industries. Use with DAM, DIM, or DDMF workflows."
09-sector-overlays,digital-infrastructure-sector-pack,"Provides market, demand, capacity, network, cloud, data-center, spectrum, cybersecurity, data-sovereignty, power, valuation, and technology analysis for digital infrastructure. Use with DAM, DIM, or DDMF workflows.",DAM/DIM/DDMF,high,Sector and decision owner,,"Provides market, demand, capacity, network, cloud, data-center, spectrum, cybersecurity, data-sovereignty, power, valuation, and technology analysis for digital infrastructure. Use with DAM, DIM, or DDMF workflows."
09-sector-overlays,infrastructure-utilities-sector-pack,"Provides demand, tariff, regulation, concession, service, asset-life, project-finance, resilience, procurement, and public-impact analysis for transport, water, waste, utilities, and critical infrastructure.",DAM/DIM/DDMF,high,Sector and decision owner,,"Provides demand, tariff, regulation, concession, service, asset-life, project-finance, resilience, procurement, and public-impact analysis for transport, water, waste, utilities, and critical infrastructure."
09-sector-overlays,financial-services-sector-pack,"Provides capital, liquidity, credit, market, insurance, payments, regulation, conduct, digital, inclusion, valuation, and systemic-risk analysis for financial-services assets and investments.",DAM/DIM,high,Sector and decision owner,,"Provides capital, liquidity, credit, market, insurance, payments, regulation, conduct, digital, inclusion, valuation, and systemic-risk analysis for financial-services assets and investments."
09-sector-overlays,food-agriculture-sector-pack,"Provides value-chain, yield, climate, input, logistics, storage, processing, trade, price, farmer, land, water, food-security, and technology analysis for food and agriculture investments.",DAM/DIM/DDMF,high,Sector and decision owner,,"Provides value-chain, yield, climate, input, logistics, storage, processing, trade, price, farmer, land, water, food-security, and technology analysis for food and agriculture investments."
09-sector-overlays,healthcare-sector-pack,"Provides demand, outcomes, capacity, reimbursement, regulation, quality, workforce, supply chain, technology, affordability, data, and public-health analysis for healthcare investments.",DAM/DIM/DDMF,high,Sector and decision owner,,"Provides demand, outcomes, capacity, reimbursement, regulation, quality, workforce, supply chain, technology, affordability, data, and public-health analysis for healthcare investments."
09-sector-overlays,real-estate-sez-sector-pack,"Provides land, planning, demand, absorption, infrastructure, tenant, anchor, financing, valuation, governance, environmental, and economic-cluster analysis for real estate and special economic zones.",DAM/DIM/DDMF,high,Sector and decision owner,,"Provides land, planning, demand, absorption, infrastructure, tenant, anchor, financing, valuation, governance, environmental, and economic-cluster analysis for real estate and special economic zones."
10-assurance-evaluation,decision-quality-gate,"Applies mandatory commercial, strategic, governance, impact, execution, evidence, downside, authority, long-term, and auditability tests before a material recommendation proceeds. Use as the final pre-decision assurance gate.",BPI/DAM/DIM/DDMF,critical,Independent assurance and decision authority,,"Applies mandatory commercial, strategic, governance, impact, execution, evidence, downside, authority, long-term, and auditability tests before a material recommendation proceeds. Use as the final pre-decision assurance gate."
10-assurance-evaluation,evidence-citation-auditor,"Verifies that material claims are supported by authoritative, current, traceable sources and that quotations, calculations, and interpretations accurately represent the evidence. Use before formal decision or publication.",BPI/DAM/DIM/DDMF,high,Independent reviewer,,"Verifies that material claims are supported by authoritative, current, traceable sources and that quotations, calculations, and interpretations accurately represent the evidence. Use before formal decision or publication."
10-assurance-evaluation,model-risk-validator,"Assesses model purpose, methodology, data, assumptions, limitations, calibration, sensitivity, governance, reproducibility, and misuse risk. Use for financial, economic, risk, forecasting, scoring, and AI models.",BPI/DAM/DIM/DDMF,critical,Independent model-risk authority,,"Assesses model purpose, methodology, data, assumptions, limitations, calibration, sensitivity, governance, reproducibility, and misuse risk. Use for financial, economic, risk, forecasting, scoring, and AI models."
10-assurance-evaluation,bias-and-independence-review,"Tests anchoring, confirmation, political, sponsor, sunk-cost, optimism, groupthink, selection, and model biases; checks reviewer independence and dissent quality. Use before material decisions and exception approvals.",BPI/DAM/DIM/DDMF,critical,Independent review owner,,"Tests anchoring, confirmation, political, sponsor, sunk-cost, optimism, groupthink, selection, and model biases; checks reviewer independence and dissent quality. Use before material decisions and exception approvals."
10-assurance-evaluation,compliance-policy-checker,"Checks outputs and proposed actions against applicable law, policy, delegations, standards, covenants, approvals, and control requirements; records exceptions and owners. Use before execution or formal submission.",BPI/DAM/DIM/DDMF,critical,Compliance/legal owner,,"Checks outputs and proposed actions against applicable law, policy, delegations, standards, covenants, approvals, and control requirements; records exceptions and owners. Use before execution or formal submission."
10-assurance-evaluation,confidentiality-leakage-check,"Tests documents, prompts, outputs, tools, recipients, metadata, and attachments for unauthorized disclosure of strategic, market-sensitive, personal, contractual, or national-interest information. Use before sharing or publication.",BPI/DAM/DIM/DDMF,critical,Information-security owner,,"Tests documents, prompts, outputs, tools, recipients, metadata, and attachments for unauthorized disclosure of strategic, market-sensitive, personal, contractual, or national-interest information. Use before sharing or publication."
10-assurance-evaluation,audit-trail-packager,"Packages request, evidence, versions, analysis, assumptions, tool actions, challenges, approvals, decisions, conditions, and follow-up into a tamper-evident audit record. Use at every material workflow milestone.",BPI/DAM/DIM/DDMF,high,Records and audit owner,,"Packages request, evidence, versions, analysis, assumptions, tool actions, challenges, approvals, decisions, conditions, and follow-up into a tamper-evident audit record. Use at every material workflow milestone."
10-assurance-evaluation,post-decision-learning,"Compares expected and actual outcomes, identifies thesis or execution errors, captures lessons, updates controls, and assigns corrective actions. Use after milestones, exits, incidents, restructurings, and material decisions.",BPI/DAM/DIM/DDMF,high,Decision owner and assurance,,"Compares expected and actual outcomes, identifies thesis or execution errors, captures lessons, updates controls, and assigns corrective actions. Use after milestones, exits, incidents, restructurings, and material decisions."
10-assurance-evaluation,skill-evaluation-runner,"Runs schema, trigger, non-trigger, functional, golden-case, adversarial, safety, governance, and regression evaluations for Claude Skills. Use before release, after changes, and on a defined monitoring cycle.",BPI,high,AI assurance owner,,"Runs schema, trigger, non-trigger, functional, golden-case, adversarial, safety, governance, and regression evaluations for Claude Skills. Use before release, after changes, and on a defined monitoring cycle."
10-assurance-evaluation,skill-lifecycle-governor,"Controls skill ownership, approval, versioning, dependencies, release, monitoring, incidents, retraining references, deprecation, archival, and periodic recertification. Use for enterprise management of the Danantara skill estate.",BPI,critical,AI Governance Committee,,"Controls skill ownership, approval, versioning, dependencies, release, monitoring, incidents, retraining references, deprecation, archival, and periodic recertification. Use for enterprise management of the Danantara skill estate."
